bill_num,amended,short_outcome,final_action,house_vote_date,senate_vote_date,leg_cosponsors,floor_sponsors,gov_action,short_desc,long_desc,topics_all,topics_coded,t1,t1_aye,t2,t2_aye,t3,t3_aye,t4,t4_aye,t5,t5_aye,bill_group,link,notes
H0812,,LAW,03/23 Governor signed; Session Law Chapter 285; Effective: 07/01/04,2004-03-12,2004-03-19,,"['Representative Deal', 'Senator Cameron']",Signed,HEALTH INSURANCE - REINSURANCE POOL - Amends existing law relating to Idaho's reinsurance pool law to provide that health benefit plans covering eligible individuals shall comply with certain provisions; to revise language regarding waiving any time period applicable to a preexisting condition; and to incorporate a portion of the Federal Health Insurance Portability and Accountability Act of 1996.                                                                          ,,,,,,,,,,,,,,,https://legislature.idaho.gov/sessioninfo/2004/legislation/H0812/,
H0813,,H St Aff,03/05 Rpt prt - to St Aff,,,,,,"LEGISLATIVE OFFICIALS - GIFTS - Amends existing law relating to bribery and corrupt influence to revise the definition for ""pecuniary benefit""; to revise the prohibition on improper gifts applicable to legislative officials; and to set forth additional exceptions.                                                                          ",,,,,,,,,,,,,,,https://legislature.idaho.gov/sessioninfo/2004/legislation/H0813/,
H0814,,H Held at desk,03/05 Rpt prt - Held at Desk,,,,,,CONTRACTORS - REGISTRATION - Adds to existing law to require contractor registration; to define terms; to provide exemptions from registration; to create the Idaho Contractors Board and the Idaho Contractors Board Fund; to set forth board powers and duties; to provide for reciprocal registration; to provide for investigations and discipline; and to provide penalties.                                                                          ,,,,,,,,,,,,,,,https://legislature.idaho.gov/sessioninfo/2004/legislation/H0814/,
H0815,,LAW,03/24 Governor signed; Session Law Chapter 333; Effective: 07/01/04,2004-03-09,2004-03-19,,"['Representative Henbest', 'Senator Ingram']",Signed,CONTROLLED SUBSTANCE ADULTERATION - Adds to existing law to provide reporting and disclosure requirements for certain health care providers who are terminated from employment for adulteration or misappropriation of controlled substances.                                                                          ,,,,,,,,,,,,,,,https://legislature.idaho.gov/sessioninfo/2004/legislation/H0815/,
H0816,Amended,VETOED,04/02 Governor VETOED,2004-03-12,2004-03-19,,"['Senator Ingram', 'Senator Stennett']",Vetoed,"CATTLE - IMPORT FROM CANADA- Amends and adds to existing law relating to the inspection and suppression of diseases in animals to prohibit the importation of cattle originating in Canada into the state of Idaho unless they are consigned directly to a slaughter facility or bear the brand ""C"" on the neck and are identified with a radio frequency identification device.                                                                          ",,,,,,,,,,,,,,,https://legislature.idaho.gov/sessioninfo/2004/legislation/H0816/,
H0817,,S Com/HuRes,03/16 Senate intro - 1st rdg - to Com/HuRes,2004-03-15,,,"['Representative Block', 'Representative Meyer & Roberts']",,AGRICULTURAL EQUIPMENT DEALERS/SUPPLIERS - Amends and adds to existing law to revise certain contractual requirements between suppliers and dealers of agricultural equipment; to provide certain prohibited practices; to provide for arbitration in Idaho; to revise procedures regarding warranty claims; and to provide application to certain data processing software.                                                                          ,,,,,,,,,,,,,,,https://legislature.idaho.gov/sessioninfo/2004/legislation/H0817/,
H0818,,LAW,03/23 Governor signed; Session Law Chapter 286; Effective: 07/01/04,2004-03-10,2004-03-18,,"['Representative Robison', 'Senator Richardson']",Signed,"APPROPRIATIONS - PUBLIC BROADCASTING - Appropriates $2,441,300 to the State Board of Education for the Idaho Educational Public Broadcasting System for fiscal year 2005; and limits the number of authorized full-time equivalent positions to 33.                                                                          ",,,,,,,,,,,,,,,https://legislature.idaho.gov/sessioninfo/2004/legislation/H0818/,
H0819,,LAW,03/23 Governor signed; Session Law Chapter 287; Effective: 07/01/04,2004-03-10,2004-03-18,,"['Representative Mitchell', 'Senator Richardson']",Signed,"APPROPRIATIONS - HISTORICAL SOCIETY - Appropriates $3,746,300 to the State Board of Education for the Idaho State Historical Society for fiscal year 2005; and limits the number of full-time equivalent positions to 48.36.                                                                          ",,,,,,,,,,,,,,,https://legislature.idaho.gov/sessioninfo/2004/legislation/H0819/,
H0820,,LAW,03/23 Governor signed; Session Law Chapter 288; Effective: 07/01/04,2004-03-10,2004-03-18,,"['Representative Robison', 'Senator Cameron']",Signed,"APPROPRIATIONS - IDAHO SCHOOL FOR THE DEAF AND THE BLIND - Appropriates $7,818,000 to the State Board of Education for the Idaho School for the Deaf and the Blind for fiscal year 2005; limits the number of full-time equivalent positions to 121.52; and authorizes certain fund deposits.                                                                          ",,,,,,,,,,,,,,,https://legislature.idaho.gov/sessioninfo/2004/legislation/H0820/,
H0821,,LAW,03/23 Governor signed; Session Law Chapter 289; Effective: 07/01/04,2004-03-10,2004-03-18,,"['Representative Eskridge', 'Senator Cameron']",Signed,"APPROPRIATIONS - STATE LIBRARY BOARD - Appropriates $3,972,500 to the State Board of Education for the State Library Board for fiscal year 2005; and limits the number of authorized full-time equivalent positions to 41.                                                                          ",,,,,,,,,,,,,,,https://legislature.idaho.gov/sessioninfo/2004/legislation/H0821/,
H0822,,LAW,04/01 Governor signed; Session Law Chapter 366; Effective: 07/01/04,2004-03-11,2004-03-18,,"['Representative Mitchell', 'Senator Richardson']",Signed,"APPROPRIATIONS - EDUCATION DEPARTMENT - Appropriates $19,216,300 to the Superintendent of Public Instruction/State Department of Education for fiscal year 2005; and limits the number of full-time equivalent positions to 132.                                                                          ",,,,,,,,,,,,,,,https://legislature.idaho.gov/sessioninfo/2004/legislation/H0822/,
H0823,,LAW,03/23 Governor signed; Session Law Chapter 206; Effective: 07/01/04,2004-03-11,2004-03-18,,"['Representative Meyer', 'Senator Richardson']",Signed,"APPROPRIATIONS - TAX APPEALS BOARD - Appropriates $331,600 to the State Board of Tax Appeals in the Department of Revenue and Taxation for fiscal year 2005; and limits the number of full-time equivalent positions to 4.                                                                          ",,,,,,,,,,,,,,,https://legislature.idaho.gov/sessioninfo/2004/legislation/H0823/,
H0824,,LAW,03/23 Governor signed; Session Law Chapter 207; Effective: 07/01/04,2004-03-11,2004-03-18,,"['Representative Meyer', 'Senator Richardson']",Signed,"APPROPRIATIONS - STATE TAX COMMISSION - Appropriates $30,368,800 to the State Tax Commission in the Department of Revenue and Taxation for fiscal year 2005; and limits the number of full-time equivalent positions to 410.5.                                                                          ",,,,,,,,,,,,,,,https://legislature.idaho.gov/sessioninfo/2004/legislation/H0824/,
H0825,,H Rev/Tax,03/10 Rpt prt - to Rev/Tax,,,,,,PROPERTY TAX - Amends existing law to provide an additional property tax exemption for certain homeowners.                                                                          ,,,,,,,,,,,,,,,https://legislature.idaho.gov/sessioninfo/2004/legislation/H0825/,
H0826,,H Rev/Tax,03/10 Rpt prt - to Rev/Tax,,,,,,PROPERTY TAX - Amends existing law to clarify that certain adjustments to the maximum amount subject to property tax exemption shall be made; to provide for certain annual adjustments to the maximum amount subject to property tax exemption; to provide for the publication and dissemination of adjustments; and to provide that the publication of adjustments shall be exempt from the provisions of the Administrative Procedure Act.                                                                          ,,,,,,,,,,,,,,,https://legislature.idaho.gov/sessioninfo/2004/legislation/H0826/,
H0827,,H Rev/Tax,03/10 Rpt prt - to Rev/Tax,,,,,,"ALTERNATIVE ENERGY - Adds to existing law to provide a sales tax exemption for equipment and supplies, with an exception, to be used for an alternative method of generation of electrical energy; to provide minimum guidelines; and to provide definitions.                                                                          ",,,,,,,,,,,,,,,https://legislature.idaho.gov/sessioninfo/2004/legislation/H0827/,
H0828,,LAW,04/02 Governor signed; Session Law Chapter 387; Effective: 07/01/04,2004-03-12,2004-03-19,,"['Representative Collins', 'Senator Compton']",Signed,INSURANCE - SURPLUS LINES - Amends existing law to revise the rate of tax on surplus lines; and to provide a correct code reference.                                                                          ,,,,,,,,,,,,,,,https://legislature.idaho.gov/sessioninfo/2004/legislation/H0828/,
H0829,,H FAILED,03/16 2nd rdg - to 3rd rdg;  Rls susp - FAILED - 31-38-1,2004-03-16,,,,,HEALTHY IDAHO ADVISORY COMMITTEE - Adds to existing law to create the Healthy Idaho Advisory Committee; to set forth membership; to provide for the election of a chair; to provide that a majority constitutes a quorum; to require monthly meetings; to provide that members serve without pay; to provide that the committee shall make recommendations; and to set forth considerations.                                                                          ,,,,,,,,,,,,,,,https://legislature.idaho.gov/sessioninfo/2004/legislation/H0829/,
H0830,,S Educ,03/15 Senate intro - 1st rdg - to Educ,2004-03-12,,,['Representative Block'],,"PROMISE SCHOLARSHIP PROGRAM - Adds to and amends existing law to provide a Drug, Alcohol and Tobacco Free Category to the Promise Scholarship Program for Idaho high school students.                                                                          ",,,,,,,,,,,,,,,https://legislature.idaho.gov/sessioninfo/2004/legislation/H0830/,
H0831,,H Com/HuRes,03/10 Rpt prt - to Com/HuRes,,,,,,PERSI - LEGISLATIVE SERVICE - Amends existing law relating to applications of the public employee retirement system to govern the computation of service retirement allowances for members whose service is accrued through legislative service in combination with other covered employment.                                                                          ,,,,,,,,,,,,,,,https://legislature.idaho.gov/sessioninfo/2004/legislation/H0831/,
H0832,,S Loc Gov,03/18 Senate intro - 1st rdg - to Loc Gov,2004-03-18,,,['Representative Smith(24)'],,PUBLIC INFRASTRUCTURE IMPROVEMENTS DISTRICTS - Adds to existing law to provide for the creation of public infrastructure improvements districts.                                                                          ,,,,,,,,,,,,,,,https://legislature.idaho.gov/sessioninfo/2004/legislation/H0832/,
H0833,,H Bus,03/11 Rpt prt - to Bus,,,,,,HEALTH INSURANCE - Adds to existing law to provide for the prompt payment of health insurance claims; to define terms; to provide for interest payments; to provide that insurers are not required to accept an assignment of payment; to provide exceptions; and to provide penalties.                                                                          ,,,,,,,,,,,,,,,https://legislature.idaho.gov/sessioninfo/2004/legislation/H0833/,
H0834,,H Bus,03/11 Rpt prt - to Bus,,,,,,"HEALTH INSURANCE - DEPARTMENT OF ADMINISTRATION - Amends existing law to revise the powers and duties of the Director of the Department of Administration relating to group insurance; to revise objectives and considerations; to provide for data collection and reports; to encourage cost containment; to provide that, after a specified date, all political subdivisions of the state shall contract with the Department of Administration for a plan of group insurance and arrangements with prepayment plans; to provide for governance of group insurance plans; to provide that the Director of the Department of Administration shall render certain services to political subdivisions of the state; and to provide for payments from political subdivisions of the state relating to group insurance.                                                                          ",,,,,,,,,,,,,,,https://legislature.idaho.gov/sessioninfo/2004/legislation/H0834/,
H0835,,LAW,03/23 Governor signed; Session Law Chapter 290; Effective: 01/01/05 for all claims with a; service date on or after 01/01/05,2004-03-16,2004-03-19,,"['Representative Deal', 'Senator Compton']",Signed,HEALTH INSURANCE - Adds to existing law to provide for the prompt payment of health insurance claims; to define terms; to provide for interest payments; to provide that insurers are not required to accept an assignment of payment; to provide exceptions; and to provide penalties.                                                                          ,,,,,,,,,,,,,,,https://legislature.idaho.gov/sessioninfo/2004/legislation/H0835/,
H0836,,LAW,"03/26 Governor signed; Session Law Chapter 350; Effective: 07/01/04",2004-03-16,2004-03-19,,"['Representative Jones', 'Senator Stennett', 'Senator Noh']",Signed,"AQUACULTURE COMMISSION - Adds to and amends existing law to provide for the Idaho Aquaculture Commission; to provide powers and duties of the commission; to provide for the deposit and disbursement of funds; to provide for audits and reports; to provide for assessments; to provide for refunds; and to provide for an opt out alternative.                                                                          ",,,,,,,,,,,,,,,https://legislature.idaho.gov/sessioninfo/2004/legislation/H0836/,
H0837,,LAW,03/23 Governor signed; Session Law Chapter 208; Effective: 07/01/04,2004-03-17,2004-03-18,,"['Representative Harwood', 'Senator Pearce']",Signed,"APPROPRIATIONS - DEPARTMENT OF ENVIRONMENTAL QUALITY - Appropriates $49,556,400 to the Department of Environmental Quality for fiscal year 2005; limits the number of full-time equivalent positions to 369.55; directs the transfer of $520,000 to the Environmental Remediation Fund; provides intent regarding Bunker Hill remediation; provides intent regarding Coeur d'Alene River Basin projects; and prohibits the transfer of appropriations out of the Air Quality Program.                                                                          ",,,,,,,,,,,,,,,https://legislature.idaho.gov/sessioninfo/2004/legislation/H0837/,
H0838,,LAW,03/23 Governor signed; Session Law Chapter 291; Effective: 07/01/04,2004-03-17,2004-03-18,,"['Representative Gagner', 'Senator Cameron']",Signed,"APPROPRIATIONS - ADMINISTRATION DEPARTMENT - Appropriating an additional $650,000 to the Department of Administration for fiscal year 2005.                                                                          ",,,,,,,,,,,,,,,https://legislature.idaho.gov/sessioninfo/2004/legislation/H0838/,
H0839,,LAW,03/24 Governor signed; Session Law Chapter 334; Effective: 07/01/04,2004-03-17,2004-03-18,,"['Representative Mitchell', 'Senator Burtenshaw']",Signed,"APPROPRIATIONS - ADDITIONAL - NURSING BOARD - Appropriating an additional $12,000 to the Department of Self-Governing Agencies for the Board of Nursing for fiscal year 2005; and authorizing an additional one-half full-time equivalent position.                                                                          ",,,,,,,,,,,,,,,https://legislature.idaho.gov/sessioninfo/2004/legislation/H0839/,
H0840,,LAW,03/24 Governor signed; Session Law Chapter 338; Effective: 03/24/04 Sections 2 and 4;; 07/01/04 All others,2004-03-17,2004-03-18,,"['Representative Bolz', 'Senator McKenzie']",Signed,"APPROPRIATIONS - OCCUPATIONAL LICENSES - Appropriating an additional $115,000 to the Department of Self-Governing Agencies for the Bureau of Occupational Licenses for fiscal year 2005; appropriating an additional $60,500 to the Department of Self-Governing Agencies for the Bureau of Occupational Licenses for fiscal year 2004; and authorizing 2 additional full-time equivalent positions for fiscal years 2004 and 2005.                                                                          ",,,,,,,,,,,,,,,https://legislature.idaho.gov/sessioninfo/2004/legislation/H0840/,
H0841,,LAW,"03/23 Governor signed; Session Law Chapter 209; Effective: 03/23/04",2004-03-17,2004-03-18,,"['Representative Eskridge', 'Senator Hill']",Signed,"APPROPRIATIONS - GOVERNOR'S OFFICE - Adds to existing law to provide that the Executive Office of the Governor is exempt from certain provisions of Idaho Code relating to the transfer of funds from one program to another within the agency.                                                                          ",,,,,,,,,,,,,,,https://legislature.idaho.gov/sessioninfo/2004/legislation/H0841/,
H0842,,LAW,03/23 Governor signed; Session Law Chapter 210; Effective: 07/01/04,2004-03-19,2004-03-20,,"['Representative Meyer', 'Senator Hill']",Signed,"APPROPRIATIONS - AGRICULTURE DEPARTMENT - Appropriates an additional $60,000 for fiscal year 2005 to the Department of Agriculture for agricultural field burning and agricultural smoke management.                                                                          ",,,,,,,,,,,,,,,https://legislature.idaho.gov/sessioninfo/2004/legislation/H0842/,
H0843,,LAW,03/26 Governor signed; Session Law Chapter 351; Effective: 03/26/04 Sections 1 through 6;; 07/01/04 All other sections,2004-03-19,2004-03-20,,"['Representative Bell', 'Senator Cameron']",Signed,"APPROPRIATIONS - WATER RESOURCES DEPARTMENT/COMMERCE DEPARTMENT - Providing legislative intent regarding development of a long-term solution to address the declines in spring flows discharging from the Eastern Snake Plain Aquifer; appropriating an additional $11,900 to the Department of Commerce for fiscal year 2004; authorizing one additional full-time equivalent position for the Department of Commerce for fiscal year 2004; appropriating an additional $12,600 to the Department of Water Resources for fiscal year 2004; authorizing one additional full-time equivalent position for the Department of Water Resources for fiscal year 2004; appropriating and authorizing a transfer of $520,000 to the Water Management Fund for fiscal year 2004; appropriating an additional $567,700 to the Department of Commerce for fiscal year 2005; authorizing one full-time equivalent position for the Department of Commerce for fiscal year 2005; appropriating an additional $72,200 to the Department of Water Resources for fiscal year 2005; authorizing one full-time equivalent position for fiscal year 2005; authorizing the redirection and transfer of certain moneys; appropriating additional moneys to the Department of Water Resources; and appropriating $500,000 to the Revolving Development Fund.                                                                          ",,,,,,,,,,,,,,,https://legislature.idaho.gov/sessioninfo/2004/legislation/H0843/,
H0844,,H Loc Gov,03/19 House intro - 1st rdg - to printing;  Rpt prt - to Loc Gov,,,,,,"OF-WAY - Adds to existing law relating to roads and rights-of-way to grant ordinance authority to a board of county commissioners to establish a process and conditions for the purpose of determining the status, regulation and location of federally-granted rights-of-way asserted to exist within the jurisdiction of the county; to provide exclusive jurisdiction of county commissioners with an exception; to provide a procedure; to provide for recording a determination; to provide for judicial review; to provide for duties and procedures regarding physical barriers and blocked access; to authorize the state board of land commissioners to make an independent determination of the existence of a federally-granted right-of-way on state endowment lands; to provide for criminal and civil trespass; to define ""federally-granted right-of-way""; to provide for reporting to the Legislature; and to provide funding.                                                                          ",,,,,,,,,,,,,,,https://legislature.idaho.gov/sessioninfo/2004/legislation/H0844/,
H0845,,LAW,03/23 Governor signed; Session Law Chapter 292; Effective: 03/23/04,2004-03-19,2004-03-20,,"['Representative Wood', 'Senator Bailey']",Signed,SILVER MEDALLIONS - Amends existing law relating to Idaho commemorative silver medallions to authorize the State Treasurer to make arrangements for the promotion of medallions and to retain amounts from the sale of medallions as necessary to repay the State Treasurer for promotion costs incurred.                                                                          ,,,,,,,,,,,,,,,https://legislature.idaho.gov/sessioninfo/2004/legislation/H0845/,
H0846,,LAW,03/23 Governor signed; Session Law Chapter 293; Effective: 07/01/04,2004-03-19,2004-03-20,,"['Representative Wood', 'Senator Bailey']",Signed,"APPROPRIATIONS - STATE TREASURER - Appropriates an additional $40,000 to the State Treasurer for fiscal year 2005 for expenses related to the purchase and promotion of commemorative silver medallions; and directing the State Treasurer to repay the General Fund.                                                                          ",,,,,,,,,,,,,,,https://legislature.idaho.gov/sessioninfo/2004/legislation/H0846/,
H0847,,LAW,04/02 Governor signed; Session Law Chapter 388; Effective: 07/01/04,2004-03-19,2004-03-20,,"['Representative Bolz', 'Senator Pearce']",Signed,"APPROPRIATIONS - EDUCATION DEPARTMENT - Appropriates an additional $190,100 to the Superintendent of Public Instruction/State Department of Education for fiscal year 2005; authorizes two additional full-time equivalent positions; and adds to existing law to provide for fees.                                                                          ",,,,,,,,,,,,,,,https://legislature.idaho.gov/sessioninfo/2004/legislation/H0847/,
H0848,,LAW,03/26 Governor signed; Session Law Chapter 352; Effective: 03/26/04,2004-03-20,2004-03-20,,"['Representative Stevenson', 'Representative Raybould', 'Senator Noh']",Signed,"GROUND WATER RIGHTS - Adds to existing law relating to the administration of ground water rights within the Eastern Snake River Plain; declaring legislative intent relating to conjunctive administration of certain water rights; declaring legislative intent relating to the provision of certain mitigation for material injury caused by ground water withdrawal and use; declaring legislative intent relating to the equitable sharing of certain mitigation and providing that beginning April 1, 2004, the holders of certain ground water rights shall be deemed nonmember participants solely for mitigation purposes in a ground water district pursuant to the provisions of Section 42-5259, Idaho Code.                                                                          ",,,,,,,,,,,,,,,https://legislature.idaho.gov/sessioninfo/2004/legislation/H0848/,
H0849,,S Res/Env,03/20 Senate intro - 1st rdg - to Res/Env,2004-03-20,,,"['Representative Stevenson', 'Representative Raybould']",,"WATER RIGHTS - Adds to existing law relating to the administration of water rights within the Eastern Snake Plain; providing legislative findings relating to hydraulic connections of the water supply in the Eastern Snake Plain Aquifer, diminished discharges from certain springs and the effect of such diminished discharges on water rights, and the scientific and legal uncertainty as to the extent of material injury caused by ground water depletions and the manner in which the state is addressing the uncertainty; declaring legislative intent relating to conjunctive administration of certain water rights, the provision of certain mitigation for material injury caused by ground water withdrawal and use, the continual progress of the state of Idaho relating to the conjunctive administration of rights to the use of interconnected surface and ground waters within the Eastern Snake Plain, the additional work that is required to achieve full and timely conjunctive administration of interconnected surface and ground water rights; declaring that it is essential that the state provide a reasonable degree of certainty in water rights administration for the benefit and safeguard of its citizens, the state, and local economies that rely upon the diversion and use of water for their viability; and determining that the ""Eastern Snake Plain Aquifer Mitigation, Recovery and Restoration Actions"" constitutes sufficient mitigation for any material injury, to the extent it is occurring, to senior water rights in the Thousand Springs Reach of the Snake River for the period from March 15 2004, through March 15, 2005.                                                                          ",,,,,,,,,,,,,,,https://legislature.idaho.gov/sessioninfo/2004/legislation/H0849/,
HCR034,,ADOPTED,01/16 To Secretary of State,2004-01-12,2004-01-12,,"['Representative Denney', 'Senator Davis', 'Senator Stennett']",,GOVERNOR - STATE OF STATE ADDRESS- Provides for a joint session of the House of Representatives and the Senate to hear the Governor's State of the State Address.                                                                          ,,,,,,,,,,,,,,,https://legislature.idaho.gov/sessioninfo/2004/legislation/HCR034/,
