bill_num,amended,short_outcome,final_action,house_vote_date,senate_vote_date,leg_cosponsors,floor_sponsors,gov_action,short_desc,long_desc,topics_all,topics_coded,t1,t1_aye,t2,t2_aye,t3,t3_aye,t4,t4_aye,t5,t5_aye,bill_group,link,notes
H0642,,LAW,03/24 Governor signed; Session Law Chapter 320; Effective: 07/01/04,2004-02-23,2004-03-15,,"['Representative Wills', 'Senator Richardson']",Signed,ADMINISTRATIVE JUDGES - Amends existing law to revise provisions relating to the election of administrative judges; and to provide that the term of service of elected and appointed administrative judges shall be provided by the rules of the Idaho Supreme Court.                                                                          ,,,,,,,,,,,,,,,https://legislature.idaho.gov/sessioninfo/2004/legislation/H0642/,
H0643,,LAW,03/24 Governor signed; Session Law Chapter 321; Effective: 07/01/04,2004-02-23,2004-03-15,,"['Representative Smith(24)', 'Senator Davis']",Signed,DOCUMENTS - FILE WITH COURT - Adds to existing law to provide for an expansion of time for commencing actions or filing documents subject to limitations of actions in the event of closure of the office of the clerk of the district court upon the happening of certain conditions.                                                                          ,,,,,,,,,,,,,,,https://legislature.idaho.gov/sessioninfo/2004/legislation/H0643/,
H0644,,LAW,03/24 Governor signed; Session Law Chapter 322; Effective: 07/01/04,2004-02-23,2004-03-15,,"['Representative Shirley', 'Senator Lodge']",Signed,"COURT ASSISTANCE OFFICES - Adds to existing law to authorize the Supreme Court to establish certain fees relating to materials, training and other services provided by court assistance offices and coordinated family services; to provide for waivers of the fees; and to provide for the collection, deposit and dedication of the fees.                                                                          ",,,,,,,,,,,,,,,https://legislature.idaho.gov/sessioninfo/2004/legislation/H0644/,
H0645,,LAW,03/23 Governor signed; Session Law Chapter 259; Effective: 07/01/04,2004-02-25,2004-03-18,,"['Representative Shepherd', 'Senator Stennett']",Signed,LIQUOR LICENSE - Amends existing law relating to the retail sale of liquor to provide application of provisions governing split ownership of a facility to a golf course for purposes of issuance of a liquor license.                                                                          ,,,,,,,,,,,,,,,https://legislature.idaho.gov/sessioninfo/2004/legislation/H0645/,
H0646,,LAW,04/02 Governor signed; Session Law Chapter 382; Effective: 07/01/04,2004-03-08,2004-03-19,,"['Representative Ring', 'Senator Compton']",Signed,"HEALTH INSTITUTION - Amends existing law to clarify that the term ""health institution"" includes private, not-for-profit hospitals, corporations or institutions or public hospitals or institutions authorized by law to provide or operate health facilities, whether directly or indirectly through affiliates in Idaho.                                                                          ",,,,,,,,,,,,,,,https://legislature.idaho.gov/sessioninfo/2004/legislation/H0646/,
H0647,,S St Aff,03/01 Senate intro - 1st rdg - to St Aff,2004-02-27,,,['Representative Deal'],,"PUBLIC EMPLOYEES - PERSONAL LIABILITY - Amends existing law to provide for required specific pleadings for any claim alleging personal liability by a public employee; to provide for dismissal of claims if certain circumstances occur; to provide for the award of reasonable attorney's fees to the public employee if certain circumstances occur; and to define the term ""public employee.""                                                                          ",,,,,,,,,,,,,,,https://legislature.idaho.gov/sessioninfo/2004/legislation/H0647/,
H0648,,LAW,03/23 Governor signed; Session Law Chapter 181; Effective: 07/01/04,2004-02-17,2004-03-19,,"['Representative Bell', 'Senator Cameron']",Signed,HAZARDOUS SUBSTANCE EMERGENCY RESPONSE FUND - Amends existing law to create the Hazardous Substance Emergency Response Fund; and to provide that recoveries by the state for reimbursed costs shall be deposited to the fund.                                                                          ,,,,,,,,,,,,,,,https://legislature.idaho.gov/sessioninfo/2004/legislation/H0648/,
H0649,,LAW,03/23 Governor signed; Session Law Chapter 260; Effective: 01/01/04,2004-02-23,2004-03-15,,"['Representative Cuddy', 'Senator Gannon']",Signed,MANUFACTURED HOUSING - Amends existing law to provide that new manufactured housing shall be subject to the occupancy tax.                                                                          ,,,,,,,,,,,,,,,https://legislature.idaho.gov/sessioninfo/2004/legislation/H0649/,
H0650,,H Rev/Tax,02/12 Rpt prt - to Rev/Tax,,,,,,REAL PROPERTY - TRANSFERS - Adds to and amends existing law relating to the transfer of real property to provide a statement of intent; to provide definitions; to provide for reporting of a transfer and change in ownership records; to provide for a property transfer certificate whereby the purchaser discloses the sales price or declares that the information is exempt from disclosure; to provide confidentiality; to provide civil and criminal penalties; and to provide that property transfer certificates are exempt from disclosure.                                                                          ,,,,,,,,,,,,,,,https://legislature.idaho.gov/sessioninfo/2004/legislation/H0650/,
H0651,Amended,LAW,03/26 Governor signed; Session Law Chapter 347; Effective: 01/01/04,2004-03-20,2004-03-16,,"['Representative Cuddy', 'Senator McKenzie']",Signed,"INCOME TAX CREDIT - Amends existing law to provide that for the income tax credit for new employees who are earning an average of fifteen dollars and fifty cents per hour and are eligible for employer provided health and accident coverage, the credit shall be one thousand dollars per employee.                                                                          ",,,,,,,,,,,,,,,https://legislature.idaho.gov/sessioninfo/2004/legislation/H0651/,
H0652,,H St Aff,02/12 Rpt prt - to St Aff,,,,,,HISTORICAL STATUES - MONUMENTS - Adds to existing law to provide a rebuttable presumption that certain statues and monuments have historical significance and value; to provide for approval by the Board of Trustees of the Idaho State Historical Society prior to movement or removal of such statues and monuments; to provide for certain petitions; to provide for findings; and to require the Attorney General to provide representation on behalf of political subdivisions under certain circumstances.                                                                          ,,,,,,,,,,,,,,,https://legislature.idaho.gov/sessioninfo/2004/legislation/H0652/,
H0653,,LAW,03/23 Governor signed; Session Law Chapter 182; Effective: 07/01/04,2004-03-02,2004-03-19,,"['Representative Jones', 'Senator Stennett', 'Senator Noh']",Signed,DOMESTIC CERVIDAE FARMS - Adds to and amends existing law to provide for the registration of domestic cervidae farms and ranches; to provide for harvesting of domestic cervidae; to provide for official permanent identification; to provide for duties and authority relating to the escape of domestic cervidae; to provide for wild ungulates; and to revise fee provisions.                                                                          ,,,,,,,,,,,,,,,https://legislature.idaho.gov/sessioninfo/2004/legislation/H0653/,
H0654,,LAW,04/01 Governor signed; Session Law Chapter 361; Effective: 07/01/04,2004-02-24,2004-03-17,,"['Representative Smith(24)', 'Senator Ingram', 'Senator Bunderson']",Signed,SINGLE COUNTYWIDE HIGHWAY DISTRICTS - Adds to and amends existing law to provide procedures for dissolution of existing single countywide highway districts; and to provide procedures where the electorate of a county adopts a countywide highway district.                                                                          ,,,,,,,,,,,,,,,https://legislature.idaho.gov/sessioninfo/2004/legislation/H0654/,
H0655,,H FAILED,03/04 3rd rdg - FAILED - 29-41-0,2004-03-04,,,,,"LOCAL HIGHWAY ECONOMIC INVESTMENT FUND - Adds to and amends existing law to create the Local Highway Economic Investment Fund; to provide moneys for the fund from increases in motor vehicle certificate of title fees; to provide for apportionment of moneys from the fund to the Local Highway Technical Assistance Council for local highway projects, local matches for federally-funded road and bridge projects and for administrative costs; and to require annual reporting to the germane committees of the Idaho Legislature.                                                                          ",,,,,,,,,,,,,,,https://legislature.idaho.gov/sessioninfo/2004/legislation/H0655/,
H0656,,LAW,03/24 Governor signed; Session Law Chapter 323; Effective: 07/01/04,2004-03-01,2004-03-19,,"['Representative Sali', 'Senator Darrington']",Signed,PASTORAL COUNSELORS - Repeals existing law relating to the licensure of pastoral counselors.                                                                          ,,,,,,,,,,,,,,,https://legislature.idaho.gov/sessioninfo/2004/legislation/H0656/,
H0657,,H Health/Wel,02/12 Rpt prt - to Health/Wel,,,,,,SUBSTANCE ABUSE - REPORT TO EMPLOYER - Amends and adds to existing law to require health care providers to report certain information relating to substance abuse; and to provide a controlled substance abuse disclosure requirement on employers of providers.                                                                          ,,,,,,,,,,,,,,,https://legislature.idaho.gov/sessioninfo/2004/legislation/H0657/,
H0658,,LAW,03/23 Governor signed; Session Law Chapter 261; Effective: 60 days after repeal of restrictions; on asset protection in the Omnibus Budget; Reconcilation Act of 1993,2004-02-25,2004-03-17,,"['Representative McGeachin', 'Senator Bailey']",Signed,LONG-TERM CARE PARTNERSHIP PROGRAM - Adds to existing law to adopt the Long-term Care Partnership Program; to define terms; to specify the operation of the program; to establish the provisions of asset disregard; to specify terms of eligibility; to provide administration by the Department of Health and Welfare with participation by the Department of Insurance; to provide notice requirements; and to provide that the law becomes effective when necessary federal repeal of restrictions occur.                                                                          ,,,,,,,,,,,,,,,https://legislature.idaho.gov/sessioninfo/2004/legislation/H0658/,
H0659,Amended,LAW,03/23 Governor signed; Session Law Chapter 262; Effective: 07/01/04,2004-02-26,2004-03-19,,"['Representative Henbest', 'Senator Sorensen']",Signed,"NURSES - Amends existing law to remove physician supervision requirements applicable to certified nurse midwives, clinical nurse specialists and nurse practitioners; and to require peer review for renewal of license.                                                                          ",,,,,,,,,,,,,,,https://legislature.idaho.gov/sessioninfo/2004/legislation/H0659/,
H0660,,H Rev/Tax,02/12 Rpt prt - to Rev/Tax,,,,,,LIBRARY DISTRICTS - Amends existing law to provide that the dollar amount of property taxes for a newly consolidated library district's budget shall not exceed one-tenth percent of the market value for assessment purposes; to increase the allowable levy for the maintenance and operation portion of the budget to a maximum of one-tenth percent of market value for assessment purposes; to place a limit on initial indebtedness not to exceed one-tenth percent on each dollar of market value for assessment purposes; and to provide that a school-community library district may levy an annual tax not to exceed one-tenth percent of market value for assessment purposes.                                                                          ,,,,,,,,,,,,,,,https://legislature.idaho.gov/sessioninfo/2004/legislation/H0660/,
H0661,,LAW,03/23 Governor signed; Session Law Chapter 263; Effective: 07/01/04,2004-02-23,2004-03-15,,"['Representative Shepherd', 'Senator Hill']",Signed,HOSPITAL DISTRICTS - Amends and adds to existing law to revise the procedures for the dissolution of hospital districts.                                                                          ,,,,,,,,,,,,,,,https://legislature.idaho.gov/sessioninfo/2004/legislation/H0661/,
H0662,,H Rev/Tax,02/12 Rpt prt - to Rev/Tax,,,,,,"LIBRARY DISTRICTS - Amends existing law to provide that any tax-supported city library, whether contiguous or noncontiguous to a library district, may join an established library district by majority vote of the qualified electors of the city.                                                                          ",,,,,,,,,,,,,,,https://legislature.idaho.gov/sessioninfo/2004/legislation/H0662/,
H0663,,LAW,03/23 Governor signed; Session Law Chapter 183; Effective: 07/01/04,2004-02-25,2004-03-15,,"['Representative Cuddy', 'Senator Malepeai']",Signed,"FOREST LAND - Amends existing law to provide that in the event payment is offered or made for taxation of forest lands, it shall be accepted by the county treasurer and applied in the manner of payment of other property tax.                                                                          ",,,,,,,,,,,,,,,https://legislature.idaho.gov/sessioninfo/2004/legislation/H0663/,
H0664,,H Jud,02/13 Rpt prt - to Jud,,,,,,"TESTIMONY - FALSE - Adds to existing law to provide a cause of action for the recovery of damages against persons or entities that produce false or misleading information, either during sworn testimony or to a fact-finder or governmental entity, that results in injury to a person.                                                                          ",,,,,,,,,,,,,,,https://legislature.idaho.gov/sessioninfo/2004/legislation/H0664/,
H0665,,H Jud,02/13 Rpt prt - to Jud,,,,,,"TRUSTS - Amends existing law relating to nonprobate transfers from a decedent's estate to specify procedure to govern settlement of claims against a nontestamentary trust; and to provide time for claims to be presented, manner of presentation and the effect of presentation.                                                                          ",,,,,,,,,,,,,,,https://legislature.idaho.gov/sessioninfo/2004/legislation/H0665/,
H0666,Amended,H Jud,03/11 3rd rdg as amen - Ret'd to Jud,,,,,,"DOGS - VICIOUS - Amends existing law to provide that a dog that injures any livestock, poultry, domesticated animals or animals kept in captivity for commercial purposes that are not trespassing is vicious; and to provide that the court may order that a vicious dog be destroyed upon a first violation.                                                                          ",,,,,,,,,,,,,,,https://legislature.idaho.gov/sessioninfo/2004/legislation/H0666/,
H0667,,S Jud,03/01 Senate intro - 1st rdg - to Jud,2004-02-27,,,['Representative Jaquet'],,"SCHOOL GROUNDS - VIOLENCE - Adds to existing law to provide that a person who willfully threatens to commit a violent act on school grounds by use of a firearm, explosive or deadly or dangerous weapon is guilty of a misdemeanor.                                                                          ",,,,,,,,,,,,,,,https://legislature.idaho.gov/sessioninfo/2004/legislation/H0667/,
H0668,,LAW,03/24 Governor signed; Session Law Chapter 337; Effective: 07/01/04,2004-02-23,2004-03-15,,"['Representative Field(18)', 'Senator Burkett', 'Senator Lodge']",Signed,"STALKING - Repeals, amends and adds to existing law to provide for the crimes of stalking in the first and second degree; to define terms; to set forth punishment; and to provide code references.                                                                          ",,,,,,,,,,,,,,,https://legislature.idaho.gov/sessioninfo/2004/legislation/H0668/,
H0669,,LAW,03/23 Governor signed; Session Law Chapter 184; Effective: 07/01/04,2004-02-25,2004-03-16,,"['Representative Bedke', 'Senator Little']",Signed,"PUBLIC LANDS - Amends existing law to revise procedures relating to the duty of the Director of the Department of Lands in contested cases; to provide that certain actions by the State Board of Land Commissioners relating to direction, control or disposition of public lands shall not be considered to be contested cases; and to provide for exceptions.                                                                          ",,,,,,,,,,,,,,,https://legislature.idaho.gov/sessioninfo/2004/legislation/H0669/,
H0670,,LAW,03/23 Governor signed; Session Law Chapter 264; Effective: 07/01/04,2004-02-23,2004-03-16,,"['Representative Roberts', 'Senator Brandt']",Signed,FOREST PRACTICES ADVISORY COMMITTEE - Amends existing law to increase membership of the Forest Practices Advisory Committee from eight members to nine members; to clarify membership of the committee; and to provide that one member shall be a nonindustrial forest landowner and one member shall be an at-large member.                                                                          ,,,,,,,,,,,,,,,https://legislature.idaho.gov/sessioninfo/2004/legislation/H0670/,
H0671,,LAW,03/24 Governor signed; Session Law Chapter 324; Effective: 07/01/04,2004-03-02,2004-03-19,,"['Representative Smylie', 'Senator Davis']",Signed,"BUSINESS CORPORATIONS - Amends, repeals and adds to existing law to revise the ""Idaho Business Corporation Act.""                                                                          ",,,,,,,,,,,,,,,https://legislature.idaho.gov/sessioninfo/2004/legislation/H0671/,
H0672,,H Bus,02/13 Rpt prt - to Bus,,,,,,ELECTRICAL CONTRACTORS/JOURNEYMEN - Amends existing law relating to electrical contractors and journeymen to provide the scope of the chapter; to provide exemptions from the provisions of the chapter; to provide exemptions from licensure; to delete references to a repealed law; to revise definitions; and to delete the code section providing exemptions.                                                                          ,,,,,,,,,,,,,,,https://legislature.idaho.gov/sessioninfo/2004/legislation/H0672/,
H0673,,H Bus,02/13 Rpt prt - to Bus,,,,,,WORKER'S COMPENSATION - Amends existing law to provide a statute of limitations on medical benefits in denied worker's compensation claims.                                                                          ,,,,,,,,,,,,,,,https://legislature.idaho.gov/sessioninfo/2004/legislation/H0673/,
H0674,,H Bus,02/13 Rpt prt - to Bus,,,,,,WORKER'S COMPENSATION - Amends existing law relating to worker's compensation to provide that evaluations of permanent impairment shall only be made by a qualified physician.                                                                          ,,,,,,,,,,,,,,,https://legislature.idaho.gov/sessioninfo/2004/legislation/H0674/,
H0675,,H Bus,02/13 Rpt prt - to Bus,,,,,,"INSURERS - HEALTH CARE POLICIES - Adds to and amends existing law to set forth requirements for insurers offering health care policies that do not meet the definition of managed care plans; to provide that health care providers shall not require insureds to make additional payments for covered services under certain plans other than specified deductibles, copayments or coinsurance once the provider agrees in writing to accept the insurer's reimbursement rate; and to revise the definition for ""managed care plan.""                                                                          ",,,,,,,,,,,,,,,https://legislature.idaho.gov/sessioninfo/2004/legislation/H0675/,
H0676,Amended,S 14th Ord,03/11 Rpt out - to 14th Ord,2004-02-26,,,"['Representative Smith(30)', 'Representative Meyer']",,HAZARDOUS WASTE - TRANSPORTATION - Amends existing law to provide references to radioactive materials; to set forth permit requirements for persons who transport certain nuclear wastes; and to provide for permit fees.                                                                          ,,,,,,,,,,,,,,,https://legislature.idaho.gov/sessioninfo/2004/legislation/H0676/,
H0677,,LAW,03/23 Governor signed; Session Law Chapter 185; Effective: 07/01/04,2004-02-24,2004-03-17,,"['Representative Bolz', 'Senator Noble']",Signed,AGRICULTURAL EQUIPMENT - Amends existing law to provide that certain agricultural equipment shall not be considered food establishments.                                                                          ,,,,,,,,,,,,,,,https://legislature.idaho.gov/sessioninfo/2004/legislation/H0677/,
H0678,,LAW,03/23 Governor signed; Session Law Chapter 186; Effective: 07/01/04,2004-03-02,2004-03-19,,"['Representative Stevenson', 'Senator Gannon']",Signed,CROP MANAGEMENT AREAS - Amends existing law to provide for petitions for the establishment of crop management areas in areas where fewer than twenty-five registered electors reside.                                                                          ,,,,,,,,,,,,,,,https://legislature.idaho.gov/sessioninfo/2004/legislation/H0678/,
H0679,,H Agric Aff,02/16 Rpt prt - to Agric Aff,,,,,,AGRICULTURAL COMMODITY DEALERS - Amends existing law to revise provisions relating to certain liens of agricultural commodity producers and agricultural commodity dealers; to revise provisions relating to the attachment of certain liens of agricultural commodity producers and agricultural commodity dealers; and to revise provisions relating to the priority of certain liens of agricultural commodity producers and agricultural commodity dealers.                                                                          ,,,,,,,,,,,,,,,https://legislature.idaho.gov/sessioninfo/2004/legislation/H0679/,
H0680,,H Agric Aff,02/20 2nd rdg - to 3rd rdg;  Ret'd to Agric Aff,,,,,,SOIL AND PLANT AMENDMENTS - Amends existing law to prohibit local regulation and legislation relating to soil and plant amendments.                                                                          ,,,,,,,,,,,,,,,https://legislature.idaho.gov/sessioninfo/2004/legislation/H0680/,
H0681,,H Agric Aff,02/20 2nd rdg - to 3rd rdg;  Ret'd to Agric Aff,,,,,,FERTILIZER - Adds to and amends existing law to prohibit local regulation and legislation relating to fertilizers.                                                                          ,,,,,,,,,,,,,,,https://legislature.idaho.gov/sessioninfo/2004/legislation/H0681/,
H0682,,LAW,03/23 Governor signed; Session Law Chapter 187; Effective: 07/01/04,2004-03-04,2004-03-19,,"['Representative Stevenson', 'Senator Williams', 'Senator Burtenshaw']",Signed,BEEF CATTLE FEEDING OPERATIONS - Amends existing law relating to beef cattle feeding operations to provide additional requirements for nutrient management plans; and to revise the authority granted to the Director of the Department of Agriculture relating to the inspection of beef cattle feeding operations.                                                                          ,,,,,,,,,,,,,,,https://legislature.idaho.gov/sessioninfo/2004/legislation/H0682/,
H0683,,LAW,03/23 Governor signed; Session Law Chapter 188; Effective: 03/23/04,2004-02-24,2004-03-17,,"['Representative Field(23)', 'Senator Burtenshaw']",Signed,"POTATO COMMISSION - Repeals, adds to and amends existing law to revise the powers and duties of the Potato Commission; to authorize and direct the Potato Commission to disseminate certain information relating to commodity facts and benefits; and to provide for the deposit of penalties.                                                                          ",,,,,,,,,,,,,,,https://legislature.idaho.gov/sessioninfo/2004/legislation/H0683/,
H0684,,LAW,03/23 Governor signed; Session Law Chapter 265; Effective: 07/01/04,2004-02-23,2004-03-17,,"['Representative Ridinger', 'Senator Keough']",Signed,"FUEL TAX REFUND - Amends existing law to provide that no refund of special fuels tax shall be paid on special fuels used while idling a registered motor vehicle; and to define ""idling.""                                                                          ",,,,,,,,,,,,,,,https://legislature.idaho.gov/sessioninfo/2004/legislation/H0684/,
H0685,,H Loc Gov,02/16 Rpt prt - to Loc Gov,,,,,,"ANNEXATION - Adds to and repeals existing law to require a city to give notice of intent to annex, to hold a public hearing and to hold an election in the affected area if certain events occur; to provide for the annexation of adjacent territory by cities; and to provide for annexation of noncontiguous territory which is occupied by a municipally owned or operated airport or landing field, with limitations.                                                                          ",,,,,,,,,,,,,,,https://legislature.idaho.gov/sessioninfo/2004/legislation/H0685/,
H0686,,LAW,03/23 Governor signed; Session Law Chapter 266; Effective: 07/01/04,2004-03-01,2004-03-18,,"['Representative Shepherd', 'Senator Marley']",Signed,FIRE MARSHAL ORDERS - Amends existing law to increase the penalty for owners or occupants failing to comply with orders of the state fire marshal for remedy or removal; to designate the entities to which penalties shall be payable; to provide that penalties may be recovered in certain civil enforcement actions under the direction of attorneys for fire districts; and to provide for the award and payment of reasonable attorney's fees and costs.                                                                          ,,,,,,,,,,,,,,,https://legislature.idaho.gov/sessioninfo/2004/legislation/H0686/,
