bill_num,amended,short_outcome,final_action,house_vote_date,senate_vote_date,leg_cosponsors,floor_sponsors,gov_action,short_desc,long_desc,topics_all,topics_coded,t1,t1_aye,t2,t2_aye,t3,t3_aye,t4,t4_aye,t5,t5_aye,bill_group,link,notes
H0473,Amended,LAW,03/23 Governor signed; Session Law Chapter 233; Effective: 07/01/04,2004-03-17,2004-03-12,,"['Representative Cuddy', 'Senator Little']",Signed,STATE HIGHWAYS - BIDS - Amends existing law relating to bids on the state highway system to provide an administrative remedy for a losing bidder to contest a contract offer; to provide for appointment of a hearing officer by the chief engineer upon receipt of an application; to provide a contested case hearing; to provide for entering a final order; and to authorize the chief engineer to award the contract to the bidder determined in the final order to be the lowest responsible bidder at a time and in a manner which shall be in the best interest of the state.                                                                          ,,,,,,,,,,,,,,,https://legislature.idaho.gov/sessioninfo/2004/legislation/H0473/,
H0474,,LAW,03/23 Governor signed; Session Law Chapter 234; Effective: 07/01/04,2004-01-29,2004-03-15,,"['Representative Smith(24)', 'Senator Keough']",Signed,"MOTOR CARRIERS - AUDITS - Amends existing law relating to motor carrier registration and audit guidelines to transfer motor carrier audit functions from the Idaho Transportation Department to the State Tax Commission; to remove rulemaking authority of the Idaho Transportation Department with respect to audit procedures; to authorize the State Tax Commission to generate a notice of deficiency and to develop a methodology to calculate such a notice; to provide that the State Tax Commission shall provide the motor carrier with notice and opportunity to use the appeals process prior to suspension of registration; and to provide that the Idaho Transportation Department shall not reregister or permit a vehicle to operate on a trip permit until all audit assessments, penalties and interest have been paid.                                                                          ",,,,,,,,,,,,,,,https://legislature.idaho.gov/sessioninfo/2004/legislation/H0474/,
H0475,,LAW,03/23 Governor signed; Session Law Chapter 235; Effective: 07/01/04,2004-01-26,2004-03-15,,"['Representative Roberts', 'Senator Bailey']",Signed,"FUELS TAX - Amends existing fuels tax law to provide that gasoline used to propel all-terrain vehicles not required to be registered under motor vehicle law or under recreational activities law is exempt from fuel tax; to provide for refunds payable on such fuel; and to expand the definition of ""recreational vehicle"" to include all-terrain vehicles.                                                                          ",,,,,,,,,,,,,,,https://legislature.idaho.gov/sessioninfo/2004/legislation/H0475/,
H0476,,H Rev/Tax,01/20 Rpt prt - to Rev/Tax,,,,,,SCHOOL DISTRICTS - Amends existing law to strike the maximum amount restrictions relating to appropriations from the state to school districts associated with the replacement of a portion of authorized school maintenance and operation property tax levies with state sales tax receipts.                                                                          ,,,,,,,,,,,,,,,https://legislature.idaho.gov/sessioninfo/2004/legislation/H0476/,
H0477,,LAW,03/10 Governor signed; Session Law Chapter 27; Effective: 07/01/04,2004-02-09,2004-03-02,,"['Representative Wood', 'Senator Compton(Duncan)']",Signed,"PROPERTY TAX - Repeals, adds to and amends existing law to delete the method of assessment for certain manufactured homes under a dealer's plate or as a sheep and cow camp; to exempt from taxation certain manufactured homes used under a dealer's plate or as a sheep and cow camp; and to provide that the State Tax Commission shall promulgate rules specifying procedures to establish average crop prices and capitalization rates and for the publication of crop prices and of the discount rate to be used to determine the capitalization rate used in calculating the exemption of the speculative portion of the value of agricultural land.                                                                          ",,,,,,,,,,,,,,,https://legislature.idaho.gov/sessioninfo/2004/legislation/H0477/,
H0478,,LAW,03/10 Governor signed; Session Law Chapter 28; Effective: 07/01/04,2004-02-09,2004-03-02,,"['Representative Smith(24)', 'Senator Gannon']",Signed,TAXATION - Amends existing law to permit use of private delivery services approved by the Internal Revenue Service to accomplish timely filing of tax returns and other tax related documents with the State Tax Commission; to change from October to September the month of the applicable federal rate used to index the interest rate on taxes and refunds; to provide that an action to foreclose a tax lien must be brought in the county in which the property is located and to clarify the limitation of time for bringing such action; and to delete references to constables and deputies and update references to agents of the State Tax Commission.                                                                          ,,,,,,,,,,,,,,,https://legislature.idaho.gov/sessioninfo/2004/legislation/H0478/,
H0479,,LAW,03/10 Governor signed; Session Law Chapter 29; Effective: 07/01/04,2004-02-09,2004-03-02,,"['Representative Collins', 'Senator Werk']",Signed,UNCLAIMED PROPERTY - Amends existing law relating to unclaimed property to require reporting of the full name and last known address of the insured or annuitant or beneficiary when unclaimed funds of more than fifty dollars held or owing under any life or endowment insurance policy or annuity contract are reported; to require that the report of abandoned property must be filed no later than November first of each year; to provide that property escheats to the state of Idaho ten years after it is received by the administrator of unclaimed property; to provide that the State Tax Commission shall record the name and last known address of the person entitled to the property within sixty days of transferring excess funds from the unclaimed property account; and to provide that statements to purchasers shall set forth amounts due by the holder.                                                                          ,,,,,,,,,,,,,,,https://legislature.idaho.gov/sessioninfo/2004/legislation/H0479/,
H0480,,LAW,03/19 Governor signed; Session Law Chapter 81; Effective: 01/01/05,2004-02-05,2004-03-10,,"['Representative Naccarato', 'Senator Bailey']",Signed,LICENSE PLATES - HISTORIC LEWISTON - Adds to and amends existing law to establish an Historic Lewiston special motor vehicle license plate program.                                                                          ,,,,,,,,,,,,,,,https://legislature.idaho.gov/sessioninfo/2004/legislation/H0480/,
H0481,,LAW,03/10 Governor signed; Session Law Chapter 30; Effective: 01/01/04,2004-02-09,2004-03-02,,"['Representative Barrett', 'Senator McKenzie']",Signed,"INCOME TAX - Amends existing law to make various changes to the Idaho Income Tax Act; to clarify the exclusion for certain dividends payable to a mutual insurance stock holding company or intermediate holding company; to provide a correct reference to the Internal Revenue Code; to provide changes in retirement age under the Social Security Act; to provide a definition of disabled; to clarify that to qualify for the deduction for certain expenses for household and dependent care, services must be paid by the individual maintaining the household; and to update the income tax withholding rate applicable to lottery winnings.                                                                          ",,,,,,,,,,,,,,,https://legislature.idaho.gov/sessioninfo/2004/legislation/H0481/,
H0482,Amended,LAW,03/23 Governor signed; Session Law Chapter 236; Effective: 07/01/04,2004-02-24,2004-03-16,,"['Representative Denney', 'Senator Cameron']",Signed,FISH AND GAME - Amends existing law relating to fish and game to revise certain controlled hunt fees.                                                                          ,,,,,,,,,,,,,,,https://legislature.idaho.gov/sessioninfo/2004/legislation/H0482/,
H0483,,LAW,03/19 Governor signed; Session Law Chapter 82; Effective: 07/01/04,2004-02-10,2004-03-10,,"['Representative Snodgrass', 'Senator Compton']",Signed,COSMETOLOGY - Amends existing law relating to licensure by the Idaho Board of Cosmetology to eliminate a requirement of work experience for instructor licenses.                                                                          ,,,,,,,,,,,,,,,https://legislature.idaho.gov/sessioninfo/2004/legislation/H0483/,
H0484,,LAW,03/19 Governor signed; Session Law Chapter 83; Effective: 07/01/04,2004-02-09,2004-03-10,,"['Representative Block', 'Senator Noble']",Signed,"RECORDS OF SURVEYS - Amends existing law to define ""basis of bearing""; and to clarify the required contents of records of surveys.                                                                          ",,,,,,,,,,,,,,,https://legislature.idaho.gov/sessioninfo/2004/legislation/H0484/,
H0485,,LAW,03/19 Governor signed; Session Law Chapter 84; Effective: 07/01/04,2004-02-09,2004-03-10,,"['Representative Douglas', 'Senator Werk']",Signed,"ENGINEERS AND LAND SURVEYORS - Amends and adds to existing law relating to professional engineers and professional land surveyors to clarify education, examination and graduate education requirements to meet qualifications for licensure; to clarify that the Board of Professional Engineers and Professional Land Surveyors may charge applicants for the cost of administration of examinations; to clarify authority of the executive director in disciplinary actions; to specify exclusive jurisdiction of the state; and to prohibit requirements for additional licenses and fees.                                                                          ",,,,,,,,,,,,,,,https://legislature.idaho.gov/sessioninfo/2004/legislation/H0485/,
H0486,,LAW,03/19 Governor signed; Session Law Chapter 85; Effective: 07/01/04,2004-02-11,2004-03-10,,"['Representative Gagner', 'Senator Noble']",Signed,REAL ESTATE APPRAISER LICENSE - Amends existing law relating to the scope of authority of the Board of Real Estate Appraisers to further define exemptions.                                                                          ,,,,,,,,,,,,,,,https://legislature.idaho.gov/sessioninfo/2004/legislation/H0486/,
H0487,,LAW,03/24 Governor signed; Session Law Chapter 310; Effective: 07/01/04,2004-02-16,2004-03-19,,"['Representative Bayer', 'Senator Davis']",Signed,INSURERS - Amends existing law to delete the requirement that insurers file copies of reports with the National Association of Insurance Commissioners.                                                                          ,,,,,,,,,,,,,,,https://legislature.idaho.gov/sessioninfo/2004/legislation/H0487/,
H0488,,LAW,03/23 Governor signed; Session Law Chapter 237; Effective: 07/01/04,2004-02-16,2004-03-16,,"['Representative Snodgrass', 'Senator Cameron']",Signed,STATE INSURANCE FUND - Amends existing law to provide that the State Insurance Fund shall be examined by the Department of Insurance at least once every five years.                                                                          ,,,,,,,,,,,,,,,https://legislature.idaho.gov/sessioninfo/2004/legislation/H0488/,
H0489,,LAW,03/19 Governor signed; Session Law Chapter 86; Effective: 07/01/04,2004-02-16,2004-03-10,,"['Representative Gagner', 'Senator Goedde']",Signed,HEALTH CARE PLANS - SELF-FUNDED - Amends existing law relating to self-funded health care plans to increase applicable deductible and obligation amounts for purposes of determining exemption from registration requirements.                                                                          ,,,,,,,,,,,,,,,https://legislature.idaho.gov/sessioninfo/2004/legislation/H0489/,
H0490,,LAW,03/19 Governor signed; Session Law Chapter 87; Effective: 07/01/04,2004-02-16,2004-03-10,,"['Representative Bayer', 'Senator Werk']",Signed,"INSURER - SURPLUS LINES - Amends existing law to require eligible surplus lines insurers to notify the director of the Department of Insurance of any changes to the insurer's name, address or state of domicile within sixty days.                                                                          ",,,,,,,,,,,,,,,https://legislature.idaho.gov/sessioninfo/2004/legislation/H0490/,
H0491,,LAW,03/19 Governor signed; Session Law Chapter 88; Effective: 07/01/04,2004-02-16,2004-03-10,,"['Representative Deal', 'Senator Werk']",Signed,INSURER - CERTIFICATE OF AUTHORITY - Amends existing law to provide that the director may issue new orders of suspension; and to provide that certificates of authority shall be deemed terminated at the end of the suspension period if not reinstated or if a new order of suspension is not issued.                                                                          ,,,,,,,,,,,,,,,https://legislature.idaho.gov/sessioninfo/2004/legislation/H0491/,
H0492,,LAW,03/19 Governor signed; Session Law Chapter 89; Effective: 07/01/04,2004-02-16,2004-03-10,,"['Representative Collins', 'Senator Compton']",Signed,INSURER - CERTIFICATE OF AUTHORITY - Amends existing law relating to insurers to require foreign corporations to submit one copy and domestic corporations to submit three copies of specified corporate documents with an application for an original certificate of authority; and to delete document requirements relating to worker's compensation insurers and authorized representation.                                                                          ,,,,,,,,,,,,,,,https://legislature.idaho.gov/sessioninfo/2004/legislation/H0492/,
H0493,,LAW,03/19 Governor signed; Session Law Chapter 90; Effective: 07/01/04,2004-02-17,2004-03-10,,"['Representative Henbest', 'Senator Goedde']",Signed,INSURERS - DEPOSIT REQUIREMENTS - Amends and repeals existing law relating to foreign and alien insurers to clarify an exception to the requirement of deposit based upon a certificate from the insurer's state of domicile; and to repeal language relating to special deposits for foreign or alien insurers writing workmen's compensation coverages in Idaho.                                                                          ,,,,,,,,,,,,,,,https://legislature.idaho.gov/sessioninfo/2004/legislation/H0493/,
H0494,,LAW,03/19 Governor signed; Session Law Chapter 91; Effective: 07/01/04,2004-02-17,2004-03-10,,"['Representative Snodgrass', 'Senator Werk']",Signed,INSURERS - Amends existing law to limit the ability of an insurer to transact insurance in Idaho based on the characteristics of the business name of the insurer; and to authorize the director of the Department of Insurance to permit or require an insurer to supplement or modify a business name in the case of a conflict of names.                                                                          ,,,,,,,,,,,,,,,https://legislature.idaho.gov/sessioninfo/2004/legislation/H0494/,
H0495,,LAW,03/23 Governor signed; Session Law Chapter 238; Effective: 07/01/04,2004-02-17,2004-03-15,,"['Representative Eberle', 'Senator Stegner']",Signed,INSURANCE DEPARTMENT DIRECTOR - DOCUMENT FILING - Amends existing law to authorize the director of the Department of Insurance to specify the place and manner of filing of documents.                                                                          ,,,,,,,,,,,,,,,https://legislature.idaho.gov/sessioninfo/2004/legislation/H0495/,
H0496,,LAW,03/19 Governor signed; Session Law Chapter 92; Effective: 07/01/04 with alternative; provisions for compliance,2004-02-17,2004-03-10,,"['Representative Gagner', 'Senator Cameron']",Signed,ANNUITIES - Amends existing law to revise minimum nonforfeiture amounts applicable to annuity contracts issued by insurers; to authorize the director to adopt rules; and to provide effective dates for nonforfeiture amount provisions.                                                                          ,,,,,,,,,,,,,,,https://legislature.idaho.gov/sessioninfo/2004/legislation/H0496/,
H0497,,LAW,03/19 Governor signed; Session Law Chapter 93; Effective: 07/01/04,2004-02-17,2004-03-10,,"['Representative Meyer', 'Senator Compton']",Signed,INSURERS - Amends existing law relating to insurance to provide that annual statements shall be prepared in accordance with specified standards of the National Association of Insurance Commissioners and revisions to such standards as adopted by the director of the Department of Insurance.                                                                          ,,,,,,,,,,,,,,,https://legislature.idaho.gov/sessioninfo/2004/legislation/H0497/,
H0498,,S FAILED,03/10 3rd rdg - FAILED - 7-26-2,2004-02-11,2004-03-10,,['Representative Gagner'],,"OCCUPATIONAL LICENSES - Amends existing law to authorize the Bureau of Occupational Licenses to conduct hearings and proceedings to revoke, suspend, refuse issuance or refuse renewal of licenses, certificates or authorities; to authorize the Bureau to suspend or refuse issuance of such licenses, certificates or authorities; to require regulated professionals to answer questions and produce documents; to provide that failure to disclose lawfully requested information shall be grounds for discipline; to provide for the filing of a petition to modify or set aside an investigative demand; and to provide that such petition filing shall not constitute misconduct or grounds for discipline except in specified circumstances.                                                                          ",,,,,,,,,,,,,,,https://legislature.idaho.gov/sessioninfo/2004/legislation/H0498/,
H0499,Amended,LAW,03/23 Governor signed; Session Law Chapter 239; Effective: 07/01/04,2004-02-24,2004-03-19,,"['Representative Deal', 'Senator Goedde']",Signed,INSURERS - DOMESTIC STOCK - Amends existing law to provide that domestic stock insurers may amend their bylaws as provided by state law; and to provide that no such amendment to an insurer's articles of incorporation shall be effectuated until a fully executed copy of the certificate of amendments has been filed with and approved by the director.                                                                          ,,,,,,,,,,,,,,,https://legislature.idaho.gov/sessioninfo/2004/legislation/H0499/,
H0500,Amended,LAW,03/16 Governor signed; Session Law Chapter 48; Effective: 07/01/04,2004-03-08,2004-03-02,,"['Representative Black', 'Senator Stennett']",Signed,ELECTIONS - Amends existing law to provide when a candidate may appeal the results of a recount or the determination that a recount is not necessary; and to revise procedures.                                                                          ,,,,,,,,,,,,,,,https://legislature.idaho.gov/sessioninfo/2004/legislation/H0500/,
H0501,,H St Aff,02/03 Ret'd to St Aff,,,,,,"GOVERNMENT BOARDS - Amends existing law to provide for no personal liability in certain instances for individuals serving on governing boards of governmental units, boards or agencies or of governmental corporations.                                                                          ",,,,,,,,,,,,,,,https://legislature.idaho.gov/sessioninfo/2004/legislation/H0501/,
H0502,,S FAILED,03/17 Reconsidered - FAILED - 17-18-0,2004-02-16,2004-03-17,,['Representative Deal'],,"TELEPHONE CORPORATIONS - Amends existing law relating to telecommunications regulation to prescribe an election by the corporation to govern applicability of the chapter to certain telephone corporations; to provide continuing authority of the Public Utilities Commission relating to telecommunications services subject to Chapter 6, Title 62, Idaho Code; and to provide for Public Utility Commission reports to the Governor and the Legislature.                                                                          ",,,,,,,,,,,,,,,https://legislature.idaho.gov/sessioninfo/2004/legislation/H0502/,
H0503,,LAW,02/05 To Governor - Governor signed; Session Law Chapter 1; Effective: 02/05/04,2004-01-26,2004-01-30,,"['Representative Bolz', 'Senator Pearce']",Signed,"APPROPRIATIONS - WATER RESOURCES DEPARTMENT - Appropriates an additional $41,000 to the Department of Water Resources for fiscal year 2004.                                                                          ",,,,,,,,,,,,,,,https://legislature.idaho.gov/sessioninfo/2004/legislation/H0503/,
H0504,,LAW,02/06 To Governor - Governor signed; Session Law Chapter 2; Effective: 02/06/04,2004-01-26,2004-02-02,,"['Representative Field(23)', 'Senator Burtenshaw']",Signed,"APPROPRIATIONS - Directs the transfer of $223,500 to the Pest Control Deficiency Fund; directs the transfer of $11,600,000 to the Fire Suppression Deficiency Fund; and directs the transfer of $297,100 to the Hazardous Substance Emergency Response Fund.                                                                          ",,,,,,,,,,,,,,,https://legislature.idaho.gov/sessioninfo/2004/legislation/H0504/,
H0505,,LAW,03/19 Governor signed; Session Law Chapter 94; Effective: 07/01/04,2004-02-10,2004-03-10,,"['Representative McKague', 'Senator Gannon']",Signed,PROPERTY TAX APPEALS - Amends existing law to delete a reference to a statute that is no longer applicable to property tax appeals.                                                                          ,,,,,,,,,,,,,,,https://legislature.idaho.gov/sessioninfo/2004/legislation/H0505/,
H0506,,LAW,03/19 Governor signed; Session Law Chapter 95; Effective: 07/01/04,2004-02-10,2004-03-10,,"['Representative Schaefer', 'Senator McKenzie']",Signed,PROPERTY TAX - APPEALS - Amends existing law to clarify the procedure to file an appeal in district court for property tax appeals from the Board of Tax Appeals.                                                                          ,,,,,,,,,,,,,,,https://legislature.idaho.gov/sessioninfo/2004/legislation/H0506/,
H0507,,H Transp,01/22 Rpt prt - to Transp,,,,,,HIGHWAYS - SLOW MOVING VEHICLES - Amends existing law to update and clarify the operation of slow moving vehicles on public highways.                                                                          ,,,,,,,,,,,,,,,https://legislature.idaho.gov/sessioninfo/2004/legislation/H0507/,
H0508,Amended,LAW,03/23 Governor signed; Session Law Chapter 240; Effective: 01/01/04,2004-02-24,2004-03-19,,"['Representative Deal', 'Senator Darrington']",Signed,JUDGES' RETIREMENT FUND - Amends existing law to provide that the Endowment Fund Investment Board shall select and contract with investment managers at the direction of the Supreme Court; to revise the investment authority relating to the Judges' Retirement Fund; and to provide that the investment board may select and contract with banks and trust companies authorized to do business in Idaho.                                                                          ,,,,,,,,,,,,,,,https://legislature.idaho.gov/sessioninfo/2004/legislation/H0508/,
H0509,,LAW,03/19 Governor signed; Session Law Chapter 96; Effective: 01/01/04,2004-02-05,2004-03-10,,"['Representative Deal', 'Senator Little']",Signed,PERMANENT ENDOWMENT FUNDS - Amends existing law to provide that permanent endowment funds and earnings reserve funds may be combined or pooled for investment.                                                                          ,,,,,,,,,,,,,,,https://legislature.idaho.gov/sessioninfo/2004/legislation/H0509/,
H0510,,LAW,02/19 To Governor - Governor signed; Session Law Chapter 13; Effective: 07/01/04,2004-02-04,2004-02-13,,"['Representative Jaquet', 'Senator Little', 'Senator Stennett']",Signed,"STATE MINERAL LANDS - Amends existing law to provide an exception for reserving state mineral lands from sale when the surface estate is identified by the State Board of Land Commissioners as having the potential highest and best use for development purposes such as residential, commercial or industrial purposes; to provide that a purchaser of lands may acquire right, title or interest in the mineral deposits; to provide for the sale of lands as a single estate when the state land is identified as having the highest and best use for development purposes; to provide that all applications to purchase those state lands that have not been identified as having the potential highest and best use for development purposes approved subsequent to the passage of this chapter shall be subject to a reservation to the state of all mineral deposits in the land.                                                                          ",,,,,,,,,,,,,,,https://legislature.idaho.gov/sessioninfo/2004/legislation/H0510/,
H0511,,LAW,03/23 Governor signed; Session Law Chapter 154; Effective: 07/01/04,2004-02-05,2004-03-15,,"['Representative Edmunson', 'Senator Little']",Signed,LAND BOARD - Amends existing law to provide that the State Board of Land Commissioners shall have power to solicit bids and contract work to be performed.                                                                          ,,,,,,,,,,,,,,,https://legislature.idaho.gov/sessioninfo/2004/legislation/H0511/,
